{
  "$schema": "https://json-schema.org/draft/2020-12/schema",
  "$id": "https://github.com/shubhs650/codeaster-en/docs/schemas/messages.schema.json",
  "title": "codeaster-en message catalogue (en/messages/<FAMILY>.en.json)",
  "description": "One code_aster message family (one file upstream code_aster/Messages/<family>.py), written by `caen extract messages` (task 1.3). The extractor owns every field except the translation fields (en, method, severity_hint, translation_source, reviewed_by, reviewed_on, note, stale), which the translate tool and reviewers fill in and which re-extraction carries over. Change the extractor (tools/codeaster_en/extract/messages.py), not the extracted fields.",
  "type": "object",
  "required": ["_generated_from", "schema_version", "family", "source", "messages"],
  "additionalProperties": false,
  "properties": {
    "_generated_from": {
      "type": "object",
      "required": ["upstream", "upstream_commit", "file", "extractor", "extractor_version"],
      "additionalProperties": false,
      "properties": {
        "upstream": {"description": "Pinned upstream tag (UPSTREAM_VERSION).", "type": ["string", "null"]},
        "upstream_commit": {"description": "Commit of the upstream/ submodule.", "type": ["string", "null"], "pattern": "^[0-9a-f]{40}$"},
        "file": {"description": "Message module, relative to upstream/.", "type": "string"},
        "extractor": {"const": "codeaster_en.extract.messages"},
        "extractor_version": {"type": "string"}
      }
    },
    "schema_version": {"const": 1},
    "family": {"description": "Upstream file name in upper case (mecanonline10.py -> MECANONLINE10). Message IDs are <FAMILY>_<N>.", "type": "string", "pattern": "^[A-Z][A-Z0-9_]*$"},
    "source": {
      "type": "object",
      "required": ["file"],
      "additionalProperties": false,
      "properties": {"file": {"type": "string"}}
    },
    "messages": {
      "description": "Keyed by the message number as a string, in numeric order.",
      "type": "object",
      "propertyNames": {"pattern": "^[0-9]+$"},
      "additionalProperties": {"$ref": "#/$defs/message"}
    }
  },
  "$defs": {
    "message": {
      "type": "object",
      "required": ["id", "fr", "placeholders", "source", "en"],
      "additionalProperties": false,
      "properties": {
        "id": {"description": "<FAMILY>_<N>, as printed in the .mess log.", "type": "string", "pattern": "^[A-Z][A-Z0-9_]*_[0-9]+$"},
        "fr": {"description": "French text verbatim (leading/trailing newlines kept): the %-format string Utmess formats with a mapping.", "type": "string"},
        "placeholders": {
          "description": "Distinct printf specifiers in fr, as written, in order of first appearance; '%%' (literal percent) included.",
          "type": "array",
          "items": {"type": "string", "pattern": "^%(%|\\([^)]*\\).+)$"},
          "uniqueItems": true
        },
        "source": {
          "type": "object",
          "required": ["line"],
          "additionalProperties": false,
          "properties": {"line": {"description": "Line of the message number in the upstream file.", "type": "integer", "minimum": 1}}
        },
        "flags": {"description": "Dict-form messages only: the 'flags' string verbatim (DECORATED, CENTER). Utmess eval()s it.", "type": "string"},
        "gettext": {"description": "Present (false) when the text is not a plain string inside _(): either not wrapped at all, or an f-string. gettext cannot translate such messages at runtime.", "const": false},
        "fstring_names": {"description": "f-string messages: module-level string constants substituted into fr.", "type": "array", "items": {"type": "string"}},
        "reachable": {"description": "Present (false) for N >= 100: Utmess.decode_idmess asserts 0 < N < 100, so the solver cannot emit the message.", "const": false},
        "en": {"description": "English text with the same placeholder set as fr; null until translated.", "type": ["string", "null"]},
        "method": {"enum": ["machine", "assisted", "reviewed"]},
        "severity_hint": {"enum": ["info", "warning", "error", "fatal"]},
        "translation_source": {"description": "Where en came from when it was not written here, e.g. upstream:i18n/en-US/aster_messages.po.", "type": "string"},
        "reviewed_by": {"type": ["string", "null"]},
        "reviewed_on": {"type": ["string", "null"], "format": "date"},
        "note": {"description": "Translator's note for the reviewer; never shown to users.", "type": "string"},
        "stale": {"description": "true when fr changed upstream after en was written.", "type": "boolean"}
      }
    }
  }
}
