{
 "_generated_from": {
  "upstream": "17.4.26",
  "upstream_commit": "5d2a06d2a4afe589468f96617080e7aabac3e4f2",
  "file": "code_aster/Messages/result1.py",
  "extractor": "codeaster_en.extract.messages",
  "extractor_version": "1"
 },
 "schema_version": 1,
 "family": "RESULT1",
 "source": {
  "file": "code_aster/Messages/result1.py"
 },
 "messages": {
  "1": {
   "id": "RESULT1_1",
   "fr": "\n  Lors de la construction ou de la lecture d'un résultat non-linéaire, le champ des variables internes lu ou créé n'est pas cohérent avec le comportement donné par le mot-clef COMPORTEMENT.\n",
   "placeholders": [],
   "source": {
    "line": 23
   },
   "en": null
  },
  "2": {
   "id": "RESULT1_2",
   "fr": "\nLe paramètre <%(k2)s> n'est pas le même sur tous les numéros d'ordre dans la structure de données résultat de nom <%(k1)s>.\nCe n'est pas possible dans cet opérateur.\n",
   "placeholders": [
    "%(k2)s",
    "%(k1)s"
   ],
   "source": {
    "line": 28
   },
   "en": null
  },
  "3": {
   "id": "RESULT1_3",
   "fr": "\nOn ne trouve aucun numéro d'ordre dans la structure de données résultat de nom <%(k1)s>\n",
   "placeholders": [
    "%(k1)s"
   ],
   "source": {
    "line": 34
   },
   "en": null
  },
  "4": {
   "id": "RESULT1_4",
   "fr": "Le modèle n'est pas unique sur tous les pas de temps. La commande ne sait pas gérer cette situation.",
   "placeholders": [],
   "source": {
    "line": 39
   },
   "en": null
  },
  "5": {
   "id": "RESULT1_5",
   "fr": "Il n'y a pas d'information relative au comportement dans le résultat. La commande ne sait pas gérer cette situation.",
   "placeholders": [],
   "source": {
    "line": 42
   },
   "en": null
  },
  "6": {
   "id": "RESULT1_6",
   "fr": "Le comportement n'est pas unique sur tous les pas de temps. La commande ne sait pas gérer cette situation.",
   "placeholders": [],
   "source": {
    "line": 45
   },
   "en": null
  },
  "7": {
   "id": "RESULT1_7",
   "fr": "On ne peut pas utiliser NOM_VARI car on n'a pas accès à la définition du comportement.",
   "placeholders": [],
   "source": {
    "line": 48
   },
   "en": null
  },
  "8": {
   "id": "RESULT1_8",
   "fr": "CE type de paramètre d'accès n'existe pas dans le résultat.",
   "placeholders": [],
   "source": {
    "line": 51
   },
   "en": null
  },
  "9": {
   "id": "RESULT1_9",
   "fr": "Le paramètre d'accès n'existe pas dans le résultat.",
   "placeholders": [],
   "source": {
    "line": 52
   },
   "en": null
  },
  "37": {
   "id": "RESULT1_37",
   "fr": "\nLe MODELE fourni par l'utilisateur est différent de celui présent dans la structure de données Résultat.\nOn poursuit les calculs avec le MODELE fourni par l'utilisateur.\n\nRisque & Conseil : Vérifiez si le MODELE fourni dans la commande est bien celui que vous souhaitez.\nSi oui, vous allez poursuivre les calculs de post-traitement avec un MODELE différent de\ncelui utilisé pour calculer les déplacements, températures,...\n",
   "placeholders": [],
   "source": {
    "line": 53
   },
   "en": null
  },
  "38": {
   "id": "RESULT1_38",
   "fr": "\nLes caractéristiques élémentaires CARA_ELEM fournies par l'utilisateur sont différentes de celles présentes dans la structure de données Résultat.\nOn poursuit les calculs avec le CARA_ELEM fourni par l'utilisateur.\n\nRisque & Conseil : Vérifiez si le CARA_ELEM fourni dans la commande est bien celui que vous souhaitez.\nSi oui, vous allez poursuivre les calculs de post-traitement avec un CARA_ELEM différent de\ncelui utilisé pour calculer les déplacements, températures,...\n",
   "placeholders": [],
   "source": {
    "line": 63
   },
   "en": null
  },
  "39": {
   "id": "RESULT1_39",
   "fr": "\nLe matériau fourni par l'utilisateur est différent de celui présent dans la structure de données Résultat.\nOn poursuit les calculs avec le matériau fourni par l'utilisateur.\n\nRisque & Conseil : Vérifiez si le matériau fourni dans la commande est bien celui que vous souhaitez.\nSi oui, vous allez poursuivre les calculs de post-traitement avec un matériau différent de\ncelui utilisé pour calculer les déplacements, températures,...\n",
   "placeholders": [],
   "source": {
    "line": 73
   },
   "en": null
  },
  "40": {
   "id": "RESULT1_40",
   "fr": "\nLe chargement fourni par l'utilisateur est différent de celui présent dans la\nstructure de données Résultat. On poursuit les calculs avec le chargement fourni par l'utilisateur.\n\nRisque & Conseil : Vérifiez si le chargement fourni dans la commande est bien celui que vous souhaitez.\nSi oui vous allez poursuivre les calculs post-traitement avec un chargement différent de celui utilisé\npour calculer les déplacements, températures,...\n",
   "placeholders": [],
   "source": {
    "line": 83
   },
   "en": null
  },
  "41": {
   "id": "RESULT1_41",
   "fr": "\nLes fonctions multiplicatrices du chargement (mot clé: FONC_MULT) fournies par l'utilisateur sont\ndifférentes de celles présentes dans la structure de données Résultat. On poursuit les calculs avec\nles fonctions multiplicatrices fournies par l'utilisateur.\n\nRisque & Conseil : Vérifiez si les fonctions fournies dans la commande sont bien celles que vous souhaitez.\nSi oui vous allez poursuivre les calculs de post-traitement avec des fonctions différentes de celles\nutilisées pour calculer les déplacements, températures,...\n",
   "placeholders": [],
   "source": {
    "line": 93
   },
   "en": null
  },
  "65": {
   "id": "RESULT1_65",
   "fr": "\nVous avez fourni %(i1)d charges alors qu'il n'y a %(i2)d dans la structure de données Résultat.\n\nRisque & Conseil :\n   Vous pouvez obtenir des résultats faux si les charges sont différentes.\n   Vérifiez que vous n'avez pas oublié de charge ou que vous n'en avez pas ajouté.\n",
   "placeholders": [
    "%(i1)d",
    "%(i2)d"
   ],
   "source": {
    "line": 104
   },
   "en": null
  },
  "66": {
   "id": "RESULT1_66",
   "fr": "\nLe couple (charge, fonction) fourni par l'utilisateur n'est pas présent dans la structure de données résultat.\nOn poursuit le calcul avec le chargement fourni par l'utilisateur.\n   Charge   (utilisateur) : %(k1)s\n   Fonction (utilisateur) : %(k2)s\n   Charge   (résultat)    : %(k3)s\n   Fonction (résultat)    : %(k4)s\n",
   "placeholders": [
    "%(k1)s",
    "%(k2)s",
    "%(k3)s",
    "%(k4)s"
   ],
   "source": {
    "line": 113
   },
   "en": null
  }
 }
}
