{
 "_generated_from": {
  "upstream": "17.4.26",
  "upstream_commit": "5d2a06d2a4afe589468f96617080e7aabac3e4f2",
  "file": "code_aster/Messages/coeur0.py",
  "extractor": "codeaster_en.extract.messages",
  "extractor_version": "1"
 },
 "schema_version": 1,
 "family": "COEUR0",
 "source": {
  "file": "code_aster/Messages/coeur0.py"
 },
 "messages": {
  "1": {
   "id": "COEUR0_1",
   "fr": "\nLe maillage indiqué par mot-clé MAILLAGE_N n'est pas utilisé. \nLe maillage considéré est celui provenant de RESU_INIT.\n",
   "placeholders": [],
   "source": {
    "line": 23
   },
   "flags": "DECORATED",
   "en": null
  },
  "2": {
   "id": "COEUR0_2",
   "fr": "\nAssemblage des %(i1)d permutations\n",
   "placeholders": [
    "%(i1)d"
   ],
   "source": {
    "line": 32
   },
   "en": null
  },
  "3": {
   "id": "COEUR0_3",
   "fr": "\nPermutation de l'assemblage %(k1)s en position %(k2)s\n",
   "placeholders": [
    "%(k1)s",
    "%(k2)s"
   ],
   "source": {
    "line": 37
   },
   "en": null
  },
  "4": {
   "id": "COEUR0_4",
   "fr": "\nIl faut renseigner au moins un des mots-clés MAILLAGE_N ou RESU_INIT.\n",
   "placeholders": [],
   "source": {
    "line": 42
   },
   "en": null
  },
  "5": {
   "id": "COEUR0_5",
   "fr": "\nLe maillage est obsolète : les groupes %(k1)s ne sont pas conformes aux orientations de la cuve.\n",
   "placeholders": [
    "%(k1)s"
   ],
   "source": {
    "line": 47
   },
   "en": null
  },
  "6": {
   "id": "COEUR0_6",
   "fr": "\nLe fichier THYC est invalide : il n'y a pas de cohérence entre le barycentre et l'épaisseur des mailles.\n",
   "placeholders": [],
   "source": {
    "line": 52
   },
   "en": null
  },
  "7": {
   "id": "COEUR0_7",
   "fr": "\nOn ne trouve que %(i1)d mailles THYC associées aux %(i2)d grilles.\n",
   "placeholders": [
    "%(i1)d",
    "%(i2)d"
   ],
   "source": {
    "line": 57
   },
   "en": null
  },
  "8": {
   "id": "COEUR0_8",
   "fr": "\nLa masse de l'assemblage %(k1)s en position %(k2)s est %(r1)1.1f kg (%(r2)1.1f daN)\n",
   "placeholders": [
    "%(k1)s",
    "%(k2)s",
    "%(r1)1.1f",
    "%(r2)1.1f"
   ],
   "source": {
    "line": 62
   },
   "flags": "DECORATED",
   "en": null
  },
  "9": {
   "id": "COEUR0_9",
   "fr": "\nLa masse totale des assemblages en coeur est %(r1)1.1f kg\n",
   "placeholders": [
    "%(r1)1.1f"
   ],
   "source": {
    "line": 70
   },
   "flags": "DECORATED",
   "en": null
  }
 }
}
