{
 "_generated_from": {
  "upstream": "17.4.26",
  "upstream_commit": "5d2a06d2a4afe589468f96617080e7aabac3e4f2",
  "file": "code_aster/Messages/energy1.py",
  "extractor": "codeaster_en.extract.messages",
  "extractor_version": "1"
 },
 "schema_version": 1,
 "family": "ENERGY1",
 "source": {
  "file": "code_aster/Messages/energy1.py"
 },
 "messages": {
  "1": {
   "id": "ENERGY1_1",
   "fr": "\nLe calcul de ENEL_ELGA n'est pas possible avec le modèle de déformation %(k1)s.\n",
   "placeholders": [
    "%(k1)s"
   ],
   "source": {
    "line": 23
   },
   "en": null
  },
  "2": {
   "id": "ENERGY1_2",
   "fr": "\nLe calcul de ENEL_ELGA n'est pas possible avec des paramètres élastiques %(k1)s.\n",
   "placeholders": [
    "%(k1)s"
   ],
   "source": {
    "line": 28
   },
   "en": null
  },
  "3": {
   "id": "ENERGY1_3",
   "fr": "\nLe calcul de ENER_TOTALE n'est pas possible avec le modèle de déformation %(k1)s.\n",
   "placeholders": [
    "%(k1)s"
   ],
   "source": {
    "line": 33
   },
   "en": null
  },
  "4": {
   "id": "ENERGY1_4",
   "fr": "\nLe calcul de %(k1)s n'est pas possible avec des paramètres élastiques %(k2)s.\n",
   "placeholders": [
    "%(k1)s",
    "%(k2)s"
   ],
   "source": {
    "line": 38
   },
   "en": null
  },
  "5": {
   "id": "ENERGY1_5",
   "fr": "\nPour l'option INDIC_SEUIL, les seules relations admises sont VMIS_ISOT_LINE, VMIS_ISOT_TRAC et VMIS_CINE_LINE.\n",
   "placeholders": [],
   "source": {
    "line": 43
   },
   "en": null
  },
  "6": {
   "id": "ENERGY1_6",
   "fr": "\nPour l'option INDIC_ENER, les seules relations admises sont VMIS_ISOT_LINE et VMIS_ISOT_TRAC.\n",
   "placeholders": [],
   "source": {
    "line": 48
   },
   "en": null
  },
  "7": {
   "id": "ENERGY1_7",
   "fr": "\nLe calcul de ETOT_ELGA n'est pas possible avec le modèle de déformation %(k1)s.\n",
   "placeholders": [
    "%(k1)s"
   ],
   "source": {
    "line": 53
   },
   "en": null
  }
 }
}
