{
 "_generated_from": {
  "upstream": "17.4.26",
  "upstream_commit": "5d2a06d2a4afe589468f96617080e7aabac3e4f2",
  "file": "code_aster/Messages/metallurgy1.py",
  "extractor": "codeaster_en.extract.messages",
  "extractor_version": "1"
 },
 "schema_version": 1,
 "family": "METALLURGY1",
 "source": {
  "file": "code_aster/Messages/metallurgy1.py"
 },
 "messages": {
  "1": {
   "id": "METALLURGY1_1",
   "fr": "Liste des comportements métallurgiques.",
   "placeholders": [],
   "source": {
    "line": 23
   },
   "en": null
  },
  "2": {
   "id": "METALLURGY1_2",
   "fr": "Liste des comportements métallurgiques pour la phase de revenu.",
   "placeholders": [],
   "source": {
    "line": 24
   },
   "en": null
  },
  "4": {
   "id": "METALLURGY1_4",
   "fr": "Affecté sur %(i1)d éléments",
   "placeholders": [
    "%(i1)d"
   ],
   "source": {
    "line": 25
   },
   "en": null
  },
  "5": {
   "id": "METALLURGY1_5",
   "fr": "  Type de phases                       : %(k1)s",
   "placeholders": [
    "%(k1)s"
   ],
   "source": {
    "line": 26
   },
   "en": null
  },
  "6": {
   "id": "METALLURGY1_6",
   "fr": "  Modèle métallurgique                 : %(k1)s",
   "placeholders": [
    "%(k1)s"
   ],
   "source": {
    "line": 27
   },
   "en": null
  },
  "8": {
   "id": "METALLURGY1_8",
   "fr": "  Nombre de phases                     : %(i1)d",
   "placeholders": [
    "%(i1)d"
   ],
   "source": {
    "line": 28
   },
   "en": null
  },
  "9": {
   "id": "METALLURGY1_9",
   "fr": "  Nombre total de variables internes   : %(i1)d",
   "placeholders": [
    "%(i1)d"
   ],
   "source": {
    "line": 29
   },
   "en": null
  },
  "10": {
   "id": "METALLURGY1_10",
   "fr": "Le résultat thermique doit contenir au moins deux pas de temps.",
   "placeholders": [],
   "source": {
    "line": 30
   },
   "en": null
  },
  "11": {
   "id": "METALLURGY1_11",
   "fr": "Le résultat thermique donné pour l'état initial doit être le même que le résultat de CALC_META.",
   "placeholders": [],
   "source": {
    "line": 31
   },
   "en": null
  },
  "51": {
   "id": "METALLURGY1_51",
   "fr": "Pour l'initialisation du calcul métallurgique dans CALC_META, on n'a pas pu trouver un et un seul instant dans la structure de données résultat pour l'instant demandé %(r1)f.",
   "placeholders": [
    "%(r1)f"
   ],
   "source": {
    "line": 34
   },
   "en": null
  },
  "52": {
   "id": "METALLURGY1_52",
   "fr": "Pour l'initialisation du calcul métallurgique dans CALC_META, on n'a pas trouvé de champ META_ELNO dans la structure de données résultat pour l'état initial.",
   "placeholders": [],
   "source": {
    "line": 37
   },
   "en": null
  },
  "73": {
   "id": "METALLURGY1_73",
   "fr": "\nLe paramètre matériau taille limite D10 n'est pas défini.\n",
   "placeholders": [],
   "source": {
    "line": 40
   },
   "en": null
  },
  "74": {
   "id": "METALLURGY1_74",
   "fr": "\nAu moins un des paramètres matériau relatifs au revenu (K et M) n'est pas défini.\nVérifiez les paramètres matériau donnés.\n",
   "placeholders": [],
   "source": {
    "line": 45
   },
   "en": null
  },
  "96": {
   "id": "METALLURGY1_96",
   "fr": "\nÉchec de l'algorithme de Newton lors du calcul des phases pour le zirconium.\n",
   "placeholders": [],
   "source": {
    "line": 51
   },
   "en": null
  }
 }
}
