{
 "_generated_from": {
  "upstream": "17.4.26",
  "upstream_commit": "5d2a06d2a4afe589468f96617080e7aabac3e4f2",
  "file": "code_aster/Messages/discretisation2.py",
  "extractor": "codeaster_en.extract.messages",
  "extractor_version": "1"
 },
 "schema_version": 1,
 "family": "DISCRETISATION2",
 "source": {
  "file": "code_aster/Messages/discretisation2.py"
 },
 "messages": {
  "79": {
   "id": "DISCRETISATION2_79",
   "fr": "\n   Arrêt par manque de temps CPU pendant les itérations de Newton, au numéro d'instant < %(i1)d >\n      - Temps moyen par itération de Newton : %(r1)f\n      - Temps restant                       : %(r2)f\n\n   La base globale est sauvegardée. Elle contient les pas archivés avant l'arrêt.\n",
   "placeholders": [
    "%(i1)d",
    "%(r1)f",
    "%(r2)f"
   ],
   "source": {
    "line": 23
   },
   "en": null
  },
  "80": {
   "id": "DISCRETISATION2_80",
   "fr": "\n   Arrêt par manque de temps CPU au numéro d'instant < %(i1)d >\n      - Temps moyen par pas de temps        : %(r1)f\n      - Temps restant                       : %(r2)f\n\n   La base globale est sauvegardée. Elle contient les pas archivés avant l'arrêt.\n",
   "placeholders": [
    "%(i1)d",
    "%(r1)f",
    "%(r2)f"
   ],
   "source": {
    "line": 32
   },
   "en": null
  }
 }
}
