{
 "_generated_from": {
  "upstream": "17.4.26",
  "upstream_commit": "5d2a06d2a4afe589468f96617080e7aabac3e4f2",
  "file": "code_aster/Messages/fluid1.py",
  "extractor": "codeaster_en.extract.messages",
  "extractor_version": "1"
 },
 "schema_version": 1,
 "family": "FLUID1",
 "source": {
  "file": "code_aster/Messages/fluid1.py"
 },
 "messages": {
  "1": {
   "id": "FLUID1_1",
   "fr": "Le comportement ne peut être qu'élastique sur une modélisation de type 3D_FLUIDE, AXIS_FLUIDE ou 2D_FLUIDE.",
   "placeholders": [],
   "source": {
    "line": 23
   },
   "en": "The behavior can only be elastic for modeling types 3D_FLUIDE, AXIS_FLUIDE or 2D_FLUIDE.",
   "method": "assisted",
   "severity_hint": "info",
   "translation_source": "session:task-3.2"
  },
  "2": {
   "id": "FLUID1_2",
   "fr": "Le calcul de l'option n'est pas possible avec la formulation %(k1)s. Il faut demander une évolution.",
   "placeholders": [
    "%(k1)s"
   ],
   "source": {
    "line": 26
   },
   "en": "The option cannot be computed with formulation %(k1)s. File a feature request.",
   "method": "assisted",
   "severity_hint": "info",
   "translation_source": "session:task-3.2"
  },
  "3": {
   "id": "FLUID1_3",
   "fr": "On n'a pas trouvé d'élément fluide en regard de l'élément d'interaction fluide-structure. On ne peut donc pas vérifier les normales.",
   "placeholders": [],
   "source": {
    "line": 29
   },
   "en": "No fluid element was found facing the fluid-structure interaction element, so the normals cannot be checked.",
   "method": "assisted",
   "severity_hint": "info",
   "translation_source": "session:task-3.2"
  },
  "4": {
   "id": "FLUID1_4",
   "fr": "Certaines normales entre fluide et structure ne sont pas orientées dans le bon sens,\nl'orientation des normales doit être sortante du fluide vers la structure.",
   "placeholders": [],
   "source": {
    "line": 32
   },
   "en": "Some fluid-structure normals do not point the right way;\nthe normals must point out of the fluid toward the structure.",
   "method": "assisted",
   "severity_hint": "info",
   "translation_source": "session:task-3.2"
  },
  "5": {
   "id": "FLUID1_5",
   "fr": "Le paramètre %(k1)s ne peut pas être supérieure ou égale à 1. Si vous ne voulez pas insérer une condition d'absorption fluide,\n            il faut tout simplement enlever les éléments absorbants fluides de la modélisation",
   "placeholders": [
    "%(k1)s"
   ],
   "source": {
    "line": 36
   },
   "en": "Parameter %(k1)s cannot be greater than or equal to 1. If you do not want a fluid absorbing condition,\n            simply remove the fluid absorbing elements from the modeling",
   "method": "assisted",
   "severity_hint": "info",
   "translation_source": "session:task-3.2"
  },
  "6": {
   "id": "FLUID1_6",
   "fr": "Le paramètre %(k1)s ne peut pas être inférieure ou égale à 0. Si vous ne voulez pas insérer une condition d'absorption fluide,\n            il faut tout simplement enlever les éléments absorbants fluides de la modélisation",
   "placeholders": [
    "%(k1)s"
   ],
   "source": {
    "line": 40
   },
   "en": "Parameter %(k1)s cannot be less than or equal to 0. If you do not want a fluid absorbing condition,\n            simply remove the fluid absorbing elements from the modeling",
   "method": "assisted",
   "severity_hint": "info",
   "translation_source": "session:task-3.2"
  },
  "7": {
   "id": "FLUID1_7",
   "fr": "Le paramètre %(k1)s ne peut pas être inférieure à 0",
   "placeholders": [
    "%(k1)s"
   ],
   "source": {
    "line": 44
   },
   "en": "Parameter %(k1)s cannot be less than 0",
   "method": "assisted",
   "severity_hint": "info",
   "translation_source": "session:task-3.2"
  },
  "8": {
   "id": "FLUID1_8",
   "fr": "\nTous les éléments fluides doivent utiliser la même formulation : U-P, U-P-PHI ou U-PSI.\n    ",
   "placeholders": [],
   "source": {
    "line": 45
   },
   "en": "\nAll fluid elements must use the same formulation: U-P, U-P-PHI or U-PSI.\n    ",
   "method": "assisted",
   "severity_hint": "info",
   "translation_source": "session:task-3.2"
  }
 }
}
