{
 "_generated_from": {
  "upstream": "17.4.26",
  "upstream_commit": "5d2a06d2a4afe589468f96617080e7aabac3e4f2",
  "file": "code_aster/Messages/charges.py",
  "extractor": "codeaster_en.extract.messages",
  "extractor_version": "1"
 },
 "schema_version": 1,
 "family": "CHARGES",
 "source": {
  "file": "code_aster/Messages/charges.py"
 },
 "messages": {
  "1": {
   "id": "CHARGES_1",
   "fr": "\nLe pilotage est interdit avec un maillage parallèle découpé\n",
   "placeholders": [],
   "source": {
    "line": 23
   },
   "en": "\nContinuation control is not allowed with a partitioned parallel mesh\n",
   "method": "assisted",
   "severity_hint": "info",
   "translation_source": "session:task-3.2"
  },
  "2": {
   "id": "CHARGES_2",
   "fr": "\nOn ne peut pas appliquer dans la même occurrence des conditions aux ddls HHO et non-HHO.\nIl faut le faire dans des occurrences séparées.\n",
   "placeholders": [],
   "source": {
    "line": 28
   },
   "en": "\nConditions on HHO and non-HHO DOFs cannot be applied in the same occurrence.\nUse separate occurrences.\n",
   "method": "assisted",
   "severity_hint": "info",
   "translation_source": "session:task-3.2"
  },
  "3": {
   "id": "CHARGES_3",
   "fr": "\nLa charge %(k1)s n'a pu être identifiée. Cette erreur est probablement due à l'utilisation d'un\nmot-clef facteur vide dans l'opérateur AFFE_CHAR_MECA, AFFE_CHAR_THER ou AFFE_CHAR_ACOU.\n",
   "placeholders": [
    "%(k1)s"
   ],
   "source": {
    "line": 34
   },
   "en": "\nLoad %(k1)s could not be identified. This error is probably caused by an\nempty factor keyword in operator AFFE_CHAR_MECA, AFFE_CHAR_THER or AFFE_CHAR_ACOU.\n",
   "method": "assisted",
   "severity_hint": "error",
   "translation_source": "session:task-3.2"
  },
  "4": {
   "id": "CHARGES_4",
   "fr": "\nLe type de chargement PRE_EPSI doit avoir la même valeur aux deux noeuds d'un même élément de poutre.\nS'il est appliqué sur des poutres homothétiques, les valeurs des paramètres de sections doivent être telles que :\n    - A1  = A2\n    - IY1 = IY2\n    - IZ1 = IZ2\n\nPour les poutres, le code ne sait pas encore traiter ce type de chargement variable sur l'élément.\n",
   "placeholders": [],
   "source": {
    "line": 40
   },
   "en": "\nA PRE_EPSI load must have the same value at both nodes of a beam element.\nIf it is applied to homothetic beams, the section parameters must satisfy:\n    - A1  = A2\n    - IY1 = IY2\n    - IZ1 = IZ2\n\nFor beams, the code cannot yet handle this type of load varying over the element.\n",
   "method": "assisted",
   "severity_hint": "info",
   "translation_source": "session:task-3.2"
  },
  "5": {
   "id": "CHARGES_5",
   "fr": "\nIl ne peut y avoir qu'une seule occurrence du chargement PRE_EPSI quand le mot-clé EPSI\nest présent.\n",
   "placeholders": [],
   "source": {
    "line": 51
   },
   "en": "\nThere can be only one occurrence of load PRE_EPSI when keyword EPSI\nis given.\n",
   "method": "assisted",
   "severity_hint": "info",
   "translation_source": "session:task-3.2"
  },
  "6": {
   "id": "CHARGES_6",
   "fr": "\nLe champ fourni à PRE_EPSI via la mot-clé EPSI contient une composante non autorisée : %(k1)s.\n",
   "placeholders": [
    "%(k1)s"
   ],
   "source": {
    "line": 57
   },
   "en": "\nThe field given to PRE_EPSI with keyword EPSI has a component that is not allowed: %(k1)s.\n",
   "method": "assisted",
   "severity_hint": "info",
   "translation_source": "session:task-3.2"
  },
  "7": {
   "id": "CHARGES_7",
   "fr": "Il n'est pas possible d'affecter une pression sur un élément de coque solide avec des fissures.",
   "placeholders": [],
   "source": {
    "line": 62
   },
   "en": "A pressure cannot be assigned to a solid shell element with cracks.",
   "method": "assisted",
   "severity_hint": "info",
   "translation_source": "session:task-3.2"
  },
  "8": {
   "id": "CHARGES_8",
   "fr": "\nLe champ fourni à PRE_EPSI via la mot-clé EPSI doit être de type CARTE ou ELGA, or il est de type : %(k1)s.\n",
   "placeholders": [
    "%(k1)s"
   ],
   "source": {
    "line": 65
   },
   "en": "\nThe field given to PRE_EPSI with keyword EPSI must be of type CARTE or ELGA, but it is of type: %(k1)s.\n",
   "method": "assisted",
   "severity_hint": "info",
   "translation_source": "session:task-3.2"
  },
  "9": {
   "id": "CHARGES_9",
   "fr": "\nLa liaison 3D_POU_ARLEQUIN n'est pas disponible avec les mailles de type %(k1)s.\n",
   "placeholders": [
    "%(k1)s"
   ],
   "source": {
    "line": 70
   },
   "en": "\nConstraint 3D_POU_ARLEQUIN is not available with elements of type %(k1)s.\n",
   "method": "assisted",
   "severity_hint": "info",
   "translation_source": "session:task-3.2"
  },
  "10": {
   "id": "CHARGES_10",
   "fr": "On n'a pas trouvé l'élément volumique rattaché à la maille de surface sur laquelle on veut appliquer une pression.",
   "placeholders": [],
   "source": {
    "line": 75
   },
   "en": "The volume element attached to the surface element where the pressure is to be applied was not found.",
   "method": "assisted",
   "severity_hint": "info",
   "translation_source": "session:task-3.2"
  },
  "11": {
   "id": "CHARGES_11",
   "fr": "\nPour FORCE_COQUE, seule la composante PRES est compatible avec les charges suiveuses",
   "placeholders": [],
   "source": {
    "line": 78
   },
   "en": "\nFor FORCE_COQUE, only component PRES is compatible with follower loads",
   "method": "assisted",
   "severity_hint": "info",
   "translation_source": "session:task-3.2"
  },
  "29": {
   "id": "CHARGES_29",
   "fr": "\nIl y a trop de chargements de type Dirichlet suiveur.\n",
   "placeholders": [],
   "source": {
    "line": 82
   },
   "en": "\nThere are too many follower Dirichlet loads.\n",
   "method": "assisted",
   "severity_hint": "info",
   "translation_source": "session:task-3.2"
  },
  "30": {
   "id": "CHARGES_30",
   "fr": "\nErreur utilisateur :\n  Le chargement contient des relations cinématiques qui sont non-linéaires\n  lorsque l'on utilise EXCIT / TYPE_CHARGE='SUIV'.\n  Mais le code ne sait pas encore traiter ces relations non linéaires.\n",
   "placeholders": [],
   "source": {
    "line": 87
   },
   "en": "\nUser error:\n  The load contains kinematic relations that are nonlinear\n  when EXCIT / TYPE_CHARGE='SUIV' is used.\n  But the code cannot yet handle these nonlinear relations.\n",
   "method": "assisted",
   "severity_hint": "error",
   "translation_source": "session:task-3.2"
  },
  "35": {
   "id": "CHARGES_35",
   "fr": "\nErreur utilisateur :\n  Le chargement contient des relations cinématiques LIAISON_SOLIDE qui sont non-linéaires lorsque l'on utilise EXCIT / TYPE_CHARGE='SUIV'.\n  Mais ce cas n'est pas traité car il y a au moins un noeud qui porte le degré de liberté DRZ.\n",
   "placeholders": [],
   "source": {
    "line": 95
   },
   "en": "\nUser error:\n  The load contains LIAISON_SOLIDE kinematic relations that are nonlinear when EXCIT / TYPE_CHARGE='SUIV' is used.\n  But this case is not handled because at least one node carries degree of freedom DRZ.\n",
   "method": "assisted",
   "severity_hint": "error",
   "translation_source": "session:task-3.2"
  },
  "36": {
   "id": "CHARGES_36",
   "fr": "\nErreur utilisateur :\n  Le chargement contient des relations cinématiques LIAISON_SOLIDE qui sont non-linéaires lorsque l'on utilise EXCIT / TYPE_CHARGE='SUIV'.\n  Mais ce cas n'est pas traité car il y a au moins un noeud qui porte les degrés de liberté DRX, DRY et DRZ.\n",
   "placeholders": [],
   "source": {
    "line": 102
   },
   "en": "\nUser error:\n  The load contains LIAISON_SOLIDE kinematic relations that are nonlinear when EXCIT / TYPE_CHARGE='SUIV' is used.\n  But this case is not handled because at least one node carries degrees of freedom DRX, DRY and DRZ.\n",
   "method": "assisted",
   "severity_hint": "error",
   "translation_source": "session:task-3.2"
  },
  "57": {
   "id": "CHARGES_57",
   "fr": "\n    AFFE_CHAR_CINE:\nVous essayez d'appliquer un déplacement selon DZ à une modélisation qui n'est pas 3D.\n\nConseil: Vérifié vos conditions aux limites.\n",
   "placeholders": [],
   "source": {
    "line": 109
   },
   "en": "\n    AFFE_CHAR_CINE:\nYou are trying to apply a displacement along DZ to a modeling type that is not 3D.\n\nAdvice: check your boundary conditions.\n",
   "method": "assisted",
   "severity_hint": "info",
   "translation_source": "session:task-3.2"
  },
  "58": {
   "id": "CHARGES_58",
   "fr": "\n    AFFE_CHAR_CINE:\nAucune maille de dimension %(i1)d n'a pu être trouvée pour le noeud %(i2)d.\n\n\nConseil: Vérifié vos conditions aux limites. En effet, pour les modèles HHO, il est nécessaire d'avoir un volume rattaché à un bord.\n",
   "placeholders": [
    "%(i1)d",
    "%(i2)d"
   ],
   "source": {
    "line": 117
   },
   "en": "\n    AFFE_CHAR_CINE:\nNo element of dimension %(i1)d could be found for node %(i2)d.\n\n\nAdvice: check your boundary conditions. HHO models need a volume attached to each boundary.\n",
   "method": "assisted",
   "severity_hint": "info",
   "translation_source": "session:task-3.2"
  }
 }
}
