{
 "_generated_from": {
  "upstream": "17.4.26",
  "upstream_commit": "5d2a06d2a4afe589468f96617080e7aabac3e4f2",
  "file": "code_aster/Messages/archivage.py",
  "extractor": "codeaster_en.extract.messages",
  "extractor_version": "1"
 },
 "schema_version": 1,
 "family": "ARCHIVAGE",
 "source": {
  "file": "code_aster/Messages/archivage.py"
 },
 "messages": {
  "1": {
   "id": "ARCHIVAGE_1",
   "fr": "\n Vous risquez d'écraser des données déjà stockées dans la structure de données résultat.\n Dernier instant stocké dans la structure de données résultat: %(r1)19.12e\n Premier instant du calcul: %(r2)19.12e\n",
   "placeholders": [
    "%(r1)19.12e",
    "%(r2)19.12e"
   ],
   "source": {
    "line": 26
   },
   "en": "\n You are likely to crush data already stored in the data structure result. \n Last moment stored in the data structure result:  %(r1)19.12e \n The first time of computation:  %(r2)19.12e \n",
   "method": "machine",
   "severity_hint": "info",
   "translation_source": "upstream:i18n/en-US/aster_messages.po"
  },
  "4": {
   "id": "ARCHIVAGE_4",
   "fr": "\n Archivage de l'état initial",
   "placeholders": [],
   "source": {
    "line": 33
   },
   "en": "\n Filing of the initial state",
   "method": "machine",
   "severity_hint": "info",
   "translation_source": "upstream:i18n/en-US/aster_messages.po"
  },
  "5": {
   "id": "ARCHIVAGE_5",
   "fr": "\n  Archivage des champs\n",
   "placeholders": [],
   "source": {
    "line": 37
   },
   "en": "\n Filing of the fields \n",
   "method": "machine",
   "severity_hint": "info",
   "translation_source": "upstream:i18n/en-US/aster_messages.po"
  },
  "6": {
   "id": "ARCHIVAGE_6",
   "fr": "Champ stocké <%(k1)s> à l'instant %(r1)19.12e pour le numéro d'ordre %(i1)d",
   "placeholders": [
    "%(k1)s",
    "%(r1)19.12e",
    "%(i1)d"
   ],
   "source": {
    "line": 42
   },
   "en": "Field <%(k1)s> stored at time step %(r1)19.12e for step index %(i1)d",
   "method": "assisted",
   "severity_hint": "info",
   "translation_source": "session:task-4.4"
  },
  "14": {
   "id": "ARCHIVAGE_14",
   "fr": "Il faut archiver au moins un champ.",
   "placeholders": [],
   "source": {
    "line": 43
   },
   "en": null
  },
  "97": {
   "id": "ARCHIVAGE_97",
   "fr": "\nErreur lors de l'archivage. Il n'y a pas d'instant de calcul pour l'instant d'archivage %(r1)f.\n",
   "placeholders": [
    "%(r1)f"
   ],
   "source": {
    "line": 44
   },
   "en": null
  },
  "98": {
   "id": "ARCHIVAGE_98",
   "fr": "\nErreur lors de l'archivage. Il y a plusieurs instants de calcul pour l'instant d'archivage %(r1)f.\n",
   "placeholders": [
    "%(r1)f"
   ],
   "source": {
    "line": 49
   },
   "en": null
  }
 }
}
