{
 "_generated_from": {
  "upstream": "17.4.26",
  "upstream_commit": "5d2a06d2a4afe589468f96617080e7aabac3e4f2",
  "file": "code_aster/Messages/utilitai7.py",
  "extractor": "codeaster_en.extract.messages",
  "extractor_version": "1"
 },
 "schema_version": 1,
 "family": "UTILITAI7",
 "source": {
  "file": "code_aster/Messages/utilitai7.py"
 },
 "messages": {
  "1": {
   "id": "UTILITAI7_1",
   "fr": "\n  Erreur dans les données\n  le paramètre %(k1)s n'existe pas dans la table %(k2)s\n",
   "placeholders": [
    "%(k1)s",
    "%(k2)s"
   ],
   "source": {
    "line": 23
   },
   "en": null
  },
  "2": {
   "id": "UTILITAI7_2",
   "fr": "\n  Erreur dans les données\n  pas de tri sur les complexes\n  paramètre:  %(k1)s\n",
   "placeholders": [
    "%(k1)s"
   ],
   "source": {
    "line": 29
   },
   "en": null
  },
  "3": {
   "id": "UTILITAI7_3",
   "fr": "\n  Erreur dans les données\n  on n'a pas trouvé de ligne dans la table %(k1)s pour le paramètre %(k2)s\n",
   "placeholders": [
    "%(k1)s",
    "%(k2)s"
   ],
   "source": {
    "line": 36
   },
   "en": null
  },
  "4": {
   "id": "UTILITAI7_4",
   "fr": "\n  Le numéro d'occurrence est invalide %(i1)d pour le mot clé facteur %(k1)s\n",
   "placeholders": [
    "%(i1)d",
    "%(k1)s"
   ],
   "source": {
    "line": 42
   },
   "en": null
  },
  "5": {
   "id": "UTILITAI7_5",
   "fr": "\n  Le numéro de la composante (pour VARI_R) est trop grand.\n    MAILLE           : %(k1)s\n    NUME_MAXI        : %(i1)d\n    NUME_CMP demandé : %(i2)d\n",
   "placeholders": [
    "%(k1)s",
    "%(i1)d",
    "%(i2)d"
   ],
   "source": {
    "line": 47
   },
   "en": null
  },
  "9": {
   "id": "UTILITAI7_9",
   "fr": "\n Si on utilise l'option normale pour les changements de repère, il faut donner\n une équation supplémentaire avec le mot-clé VECT_X ou VECT_Y\n ",
   "placeholders": [],
   "source": {
    "line": 55
   },
   "en": null
  },
  "11": {
   "id": "UTILITAI7_11",
   "fr": "\n  Erreur dans les données, problème lors du traitement du mot clé facteur FILTRE\n\n  -> Risque & Conseil :\n   soit le paramètre n'existe pas\n   soit aucune ligne ne correspond au paramètre donné\n",
   "placeholders": [],
   "source": {
    "line": 61
   },
   "en": null
  },
  "12": {
   "id": "UTILITAI7_12",
   "fr": "\n  Erreur utilisateur dans la commande POST_ELEM/INTEGRALE :\n    Pour le champ %(k1)s,\n    Sur les mailles sélectionnées %(k2)s,\n    On n'a pas trouvé la composante %(k3)s\n\n  Risque & Conseil:\n    Veuillez vérifier que le champ est défini sur les mailles du groupe spécifié et\n    que les composantes du champ disposent de valeurs. Vous pouvez effectuer un\n    IMPR_RESU pour imprimer les valeurs du champ %(k1)s sur les mailles sélectionnées.\n",
   "placeholders": [
    "%(k1)s",
    "%(k2)s",
    "%(k3)s"
   ],
   "source": {
    "line": 70
   },
   "en": null
  },
  "13": {
   "id": "UTILITAI7_13",
   "fr": "\n  Erreur utilisateur dans la commande POST_ELEM/INTEGRALE :\n    Le champ %(k1)s est un CHAM_ELEM ELEM,\n    Il faut renseigner le mot clé INTEGRALE / DEJA_INTEGRE= 'OUI' / 'NON'\n",
   "placeholders": [
    "%(k1)s"
   ],
   "source": {
    "line": 83
   },
   "en": null
  },
  "14": {
   "id": "UTILITAI7_14",
   "fr": "\n  POST_ELEM VOLUMOGRAMME\n  Numéro d'occurrence du mot-clé VOLUMOGRAMME = %(i1)d\n  Numéro d'ordre                             = %(i2)d\n  Volume total concerné                      = %(r1)g\n",
   "placeholders": [
    "%(i1)d",
    "%(i2)d",
    "%(r1)g"
   ],
   "source": {
    "line": 90
   },
   "en": null
  }
 }
}
