{
 "_generated_from": {
  "upstream": "17.4.26",
  "upstream_commit": "5d2a06d2a4afe589468f96617080e7aabac3e4f2",
  "file": "code_aster/Messages/unilater.py",
  "extractor": "codeaster_en.extract.messages",
  "extractor_version": "1"
 },
 "schema_version": 1,
 "family": "UNILATER",
 "source": {
  "file": "code_aster/Messages/unilater.py"
 },
 "messages": {
  "1": {
   "id": "UNILATER_1",
   "fr": "\nDéfinition d'une liaison unilatérale.\n -> Cette fonctionnalité suppose la symétrie de la matrice obtenue après assemblage.\n\nIl est possible de forcer la matrice à être symétrique en renseignant MATR_RIGI_SYME='OUI' sous le mot-clé facteur NEWTON ou d'utiliser ALGO_CONT='PENALISATION' dans LIAISON_UNILATER.\n\n",
   "placeholders": [],
   "source": {
    "line": 23
   },
   "en": null
  },
  "42": {
   "id": "UNILATER_42",
   "fr": "\nDéfinition d'une liaison unilatérale.\nLe nombre de COEF_MULT n'est pas égal au nombre de grandeurs contenus dans\nle vecteur NOM_CMP\n",
   "placeholders": [],
   "source": {
    "line": 32
   },
   "en": "\nDefinition of a unilateral connection. \nThe number of COEF_MULT equal to the number of quantities is not contained in\n vector NOM_CMP \n",
   "method": "machine",
   "severity_hint": "info",
   "translation_source": "upstream:i18n/en-US/aster_messages.po"
  },
  "43": {
   "id": "UNILATER_43",
   "fr": "\nDéfinition d'une liaison unilatérale.\nIl y a trop de grandeurs dans le vecteur NOM_CMP (limité à 30)\n",
   "placeholders": [],
   "source": {
    "line": 39
   },
   "en": "\nDefinition of a unilateral connection. \nThere are too many quantities in vector NOM_CMP (restricted to 30) \n",
   "method": "machine",
   "severity_hint": "info",
   "translation_source": "upstream:i18n/en-US/aster_messages.po"
  },
  "48": {
   "id": "UNILATER_48",
   "fr": "\nDéfinition d'une liaison unilatérale.\nAucun noeud n'est affecté par une liaison unilatérale.\n",
   "placeholders": [],
   "source": {
    "line": 45
   },
   "en": "\nDefinition of a unilateral connection. \nNo node is affected by a unilateral connection. \n",
   "method": "machine",
   "severity_hint": "info",
   "translation_source": "upstream:i18n/en-US/aster_messages.po"
  },
  "58": {
   "id": "UNILATER_58",
   "fr": "\nDéfinition d'une liaison unilatérale.\nLa composante %(k2)s existe sur le noeud %(k1)s\n",
   "placeholders": [
    "%(k2)s",
    "%(k1)s"
   ],
   "source": {
    "line": 51
   },
   "en": "\nDefinition of a unilateral connection. \nThe component %(k2)s exists on the node  %(k1)s \n",
   "method": "machine",
   "severity_hint": "info",
   "translation_source": "upstream:i18n/en-US/aster_messages.po"
  },
  "75": {
   "id": "UNILATER_75",
   "fr": "\nDéfinition d'une liaison unilatérale.\nLa composante %(k2)s est inexistante sur le noeud %(k1)s\n",
   "placeholders": [
    "%(k2)s",
    "%(k1)s"
   ],
   "source": {
    "line": 57
   },
   "en": "\nDefinition of a unilateral connection. \nThe component %(k2)s is non-existent on the node  %(k1)s \n",
   "method": "machine",
   "severity_hint": "info",
   "translation_source": "upstream:i18n/en-US/aster_messages.po"
  }
 }
}
