{
 "_generated_from": {
  "upstream": "17.4.26",
  "upstream_commit": "5d2a06d2a4afe589468f96617080e7aabac3e4f2",
  "file": "code_aster/Messages/rupture2.py",
  "extractor": "codeaster_en.extract.messages",
  "extractor_version": "1"
 },
 "schema_version": 1,
 "family": "RUPTURE2",
 "source": {
  "file": "code_aster/Messages/rupture2.py"
 },
 "messages": {
  "1": {
   "id": "RUPTURE2_1",
   "fr": "\nIl y a trop de chargements de type fonction à gérer pour CALC_G.\n",
   "placeholders": [],
   "source": {
    "line": 23
   },
   "en": "\nThere are too many function-type loads for CALC_G to handle.\n",
   "method": "assisted",
   "severity_hint": "info",
   "translation_source": "session:task-3.2"
  },
  "2": {
   "id": "RUPTURE2_2",
   "fr": "\n La combinaison de chargements de même type n'est pas autorisée car l'un des chargements\n contient une charge exprimée par une formule.\n Pour réaliser cette combinaison, vous devez transformer votre charge 'formule' en charge 'fonction'\n (via l'opérateur DEFI_FONCTION ou CALC_FONC_INTERP)\n",
   "placeholders": [],
   "source": {
    "line": 28
   },
   "en": "\n Combining loads of the same type is not allowed because one of the loads\n contains a load expressed by a formula.\n To make this combination, convert your 'formula' load into a 'function' load\n (with DEFI_FONCTION or CALC_FONC_INTERP)\n",
   "method": "assisted",
   "severity_hint": "info",
   "translation_source": "session:task-3.2"
  },
  "3": {
   "id": "RUPTURE2_3",
   "fr": "\n La combinaison des chargements n'a pas de sens physique (pesanteur, déformation initiale ou rotation).\n Pour un chargement de type ROTATION, utilisez plutôt FORCE_INTERNE.\n",
   "placeholders": [],
   "source": {
    "line": 36
   },
   "en": "\n This combination of loads has no physical meaning (gravity, initial strain or rotation).\n For a ROTATION load, use FORCE_INTERNE instead.\n",
   "method": "assisted",
   "severity_hint": "info",
   "translation_source": "session:task-3.2"
  },
  "4": {
   "id": "RUPTURE2_4",
   "fr": "\n La combinaison 'fonction multiplicatrice' et 'chargement de type fonction' n'est pas autorisée car\n votre chargement %(k1)s contient une charge exprimée par une formule.\n Pour réaliser cette combinaison, vous devez transformer votre charge 'formule' en charge 'fonction'\n (via l'opérateur DEFI_FONCTION ou CALC_FONC_INTERP).\n On poursuit sans tenir compte de la fonction multiplicatrice.\n",
   "placeholders": [
    "%(k1)s"
   ],
   "source": {
    "line": 42
   },
   "en": "\n Combining a 'multiplier function' with a 'function-type load' is not allowed because\n your load %(k1)s contains a load expressed by a formula.\n To make this combination, convert your 'formula' load into a 'function' load\n (with DEFI_FONCTION or CALC_FONC_INTERP).\n The computation continues without the multiplier function.\n",
   "method": "assisted",
   "severity_hint": "info",
   "translation_source": "session:task-3.2"
  },
  "5": {
   "id": "RUPTURE2_5",
   "fr": "\n Une fissure XFEM de type cohésive n'est utilisable qu'avec les lissages LAGRANGE/LAGRANGE_NO_NO,\n en 3D, avec l'option CALC_K_G.\n",
   "placeholders": [],
   "source": {
    "line": 51
   },
   "en": "\n A cohesive XFEM crack can only be used with smoothings LAGRANGE/LAGRANGE_NO_NO,\n in 3D, with option CALC_K_G.\n",
   "method": "assisted",
   "severity_hint": "info",
   "translation_source": "session:task-3.2"
  },
  "6": {
   "id": "RUPTURE2_6",
   "fr": "\n La recherche du point d'intersection entre la loi cohésive et la pénalisation de Lagrange a demandé beaucoup d'itération.\n Une modification des paramètres de la loi cohésive comme PENA_LAGR rendra le calcul plus rapide pour le même résultat.\n",
   "placeholders": [],
   "source": {
    "line": 57
   },
   "en": "\n Finding the intersection point between the cohesive law and the Lagrange penalty took many iterations.\n Changing parameters of the cohesive law such as PENA_LAGR will make the computation faster for the same result.\n",
   "method": "assisted",
   "severity_hint": "info",
   "translation_source": "session:task-3.2"
  }
 }
}
