{
 "_generated_from": {
  "upstream": "17.4.26",
  "upstream_commit": "5d2a06d2a4afe589468f96617080e7aabac3e4f2",
  "file": "code_aster/Messages/elements6.py",
  "extractor": "codeaster_en.extract.messages",
  "extractor_version": "1"
 },
 "schema_version": 1,
 "family": "ELEMENTS6",
 "source": {
  "file": "code_aster/Messages/elements6.py"
 },
 "messages": {
  "2": {
   "id": "ELEMENTS6_2",
   "fr": "\nOn ne sait pas calculer les déformations plastiques avec de l'élasticité non-isotrope.\n",
   "placeholders": [],
   "source": {
    "line": 23
   },
   "en": null
  },
  "3": {
   "id": "ELEMENTS6_3",
   "fr": "\n  -> Attention vous êtes en contraintes planes, et vous utilisez la loi\n     de comportement %(k1)s. La composante du tenseur des déformations\n     plastiques EPZZ est calculée en supposant l'incompressibilité des\n     déformations plastiques : EPZZ = -(EPXX + EPYY).\n  -> Risque & Conseil :\n     Vérifiez que cette expression est valide avec votre loi de comportement.\n",
   "placeholders": [
    "%(k1)s"
   ],
   "source": {
    "line": 28
   },
   "en": null
  },
  "5": {
   "id": "ELEMENTS6_5",
   "fr": "\nOn ne peut pas utiliser le modèle 3D_SI avec un comportement élastique de type %(k1)s.\n",
   "placeholders": [
    "%(k1)s"
   ],
   "source": {
    "line": 38
   },
   "en": null
  },
  "6": {
   "id": "ELEMENTS6_6",
   "fr": "\n  -> Erreur de programmation :\n  -> L argument %(k1)s est manquant ou mal renseigné dans une routine élémentaire XFEM\n  -> Veuillez renseigner cette argument\n",
   "placeholders": [
    "%(k1)s"
   ],
   "source": {
    "line": 43
   },
   "en": null
  },
  "9": {
   "id": "ELEMENTS6_9",
   "fr": "\n  -> Erreur de programmation :\n  -> En dimension %(i1)d, le calcul d'une matrice de passage n'a pas de sens.\n",
   "placeholders": [
    "%(i1)d"
   ],
   "source": {
    "line": 50
   },
   "en": null
  },
  "10": {
   "id": "ELEMENTS6_10",
   "fr": "\n  -> Erreur de programmation :\n  -> Au moins un des paramètres élastiques (module d'Young ou coefficient de poisson) n'a\n     pas été trouvé lors de l'évaluation des fonctions vectorielles XFEM\n",
   "placeholders": [],
   "source": {
    "line": 56
   },
   "en": null
  }
 }
}
