{
 "_generated_from": {
  "upstream": "17.4.26",
  "upstream_commit": "5d2a06d2a4afe589468f96617080e7aabac3e4f2",
  "file": "code_aster/Messages/veriferraillage.py",
  "extractor": "codeaster_en.extract.messages",
  "extractor_version": "1"
 },
 "schema_version": 1,
 "family": "VERIFERRAILLAGE",
 "source": {
  "file": "code_aster/Messages/veriferraillage.py"
 },
 "messages": {
  "1": {
   "id": "VERIFERRAILLAGE_1",
   "fr": "\n Commande VERI_FERRAILLAGE :\n   CHAM_FERR : Le champ de densité de ferraillage entré n'est pas un champ élémentaire constant par élément. Veuillez entrer un champ élémentaire constant par élément.\n",
   "placeholders": [],
   "source": {
    "line": 23
   },
   "en": null
  },
  "2": {
   "id": "VERIFERRAILLAGE_2",
   "fr": "\n Commande VERI_FERRAILLAGE :\n   CHAM_FERR : Le champ entré ne contient pas les densités de ferraillage.\n   Conseil : on suggère de créer un champ élémentaire de type ELEM_FER2_R avec la commande CREA_CHAMP.\n",
   "placeholders": [],
   "source": {
    "line": 29
   },
   "en": null
  },
  "3": {
   "id": "VERIFERRAILLAGE_3",
   "fr": "\n Commande VERI_FERRAILLAGE :\n   CHAM_FERR : Le maillage associé à CHAM_FERR est différent de celui associé au modèle de calcul.\n",
   "placeholders": [],
   "source": {
    "line": 36
   },
   "en": null
  },
  "5": {
   "id": "VERIFERRAILLAGE_5",
   "fr": "\n Commande VERI_FERRAILLAGE :\n   CHAM_REFE : Le champ des efforts généralisés en entré ne contient pas la grandeur SIEF_R (qui contient les efforts généralisés). Veuillez entrer un champ élémentaire contenant la grandeur ELEM_FER2_R.\n",
   "placeholders": [],
   "source": {
    "line": 48
   },
   "en": null
  },
  "6": {
   "id": "VERIFERRAILLAGE_6",
   "fr": "\n Commande VERI_FERRAILLAGE :\n   CHAM_REFE : Le maillage associé à CHAM_REFE est différent de celui associé au modèle de calcul.\n   ",
   "placeholders": [],
   "source": {
    "line": 54
   },
   "en": null
  },
  "8": {
   "id": "VERIFERRAILLAGE_8",
   "fr": "\n Erreur utilisateur commande VERI_FERRAILLAGE / TYPE_COMB = ELU :\n   Certains mots-clé de VERI_FERRAILLAGE / AFFE sont obligatoires pour un calcul à l'ELU :\n     pour CODIFICATION = 'BAEL91' : FE, FCJ, GAMMA_S, GAMMA_C, TYPE_DIAGRAMME et EYS\n     pour CODIFICATION = 'EC2' : FYK, FCK, GAMMA_S, GAMMA_C, TYPE_DIAGRAMME et EYS\n",
   "placeholders": [],
   "source": {
    "line": 66
   },
   "en": null
  },
  "9": {
   "id": "VERIFERRAILLAGE_9",
   "fr": "\n Erreur utilisateur commande VERI_FERRAILLAGE / TYPE_COMB = ELS :\n   Certains mots-clé de VERI_FERRAILLAGE / AFFE sont obligatoires pour un calcul à l'ELS :\n     pour CODIFICATION = 'BAEL91' : N,SIGS_ELS,SIGC_INF_ELS,SIGC_SUP_ELS\n     pour CODIFICATION = 'EC2' : ALPHA_E,SIGS_ELS,SIGC_INF_ELS,SIGC_SUP_ELS,EYS\n",
   "placeholders": [],
   "source": {
    "line": 74
   },
   "en": null
  },
  "10": {
   "id": "VERIFERRAILLAGE_10",
   "fr": "\n Erreur commande VERI_FERRAILLAGE :\n   On n'a pas réussi à calculer la carte de marge sur un élément.\n   (h/2-c) est négatif ou nul (l'utilisateur a fourni des valeurs d'enrobage incompatibles avec l'épaisseur de l'élément)\n",
   "placeholders": [],
   "source": {
    "line": 82
   },
   "en": null
  },
  "11": {
   "id": "VERIFERRAILLAGE_11",
   "fr": "\n Commande VERI_FERRAILLAGE :\n  Le point correspondant aux efforts généralisés de référence est situé en dehors du diagramme d'interaction sur au moins une facette.\n  La marge dans ce cas est fixée égale à 2.0. Les efforts normaux et moments résistants de rupture\n  et la distance entre le point correspondant au torseur de référence et celui correspondant au torseur résistant de rupture sont fixés à -1. Les valeurs relatives à l'état de la section sont fixées à -1.\n",
   "placeholders": [],
   "source": {
    "line": 89
   },
   "en": null
  },
  "12": {
   "id": "VERIFERRAILLAGE_12",
   "fr": "\n Commande POST_VERI_FERRAILLAGE :\n  Le groupe de mailles ne fait pas partie du maillage sur lequel le champ de marge s'appuie. Veuillez fournir un autre GROUP_MA.\n",
   "placeholders": [],
   "source": {
    "line": 97
   },
   "en": null
  },
  "13": {
   "id": "VERIFERRAILLAGE_13",
   "fr": "\n Commande POST_VERI_FERRAILLAGE :\n  Aucune maille n'a une marge inférieure au seuil. Veuillez définir un seuil supérieur.\n",
   "placeholders": [],
   "source": {
    "line": 103
   },
   "en": null
  },
  "14": {
   "id": "VERIFERRAILLAGE_14",
   "fr": "\n Commande POST_VERI_FERRAILLAGE :\n  Le nombre de diagrammes demandés est supérieur au nombre total de mailles. Veuillez fournir un nombre NB_DIAG inférieur au nombre total de mailles.\n",
   "placeholders": [],
   "source": {
    "line": 109
   },
   "en": null
  },
  "15": {
   "id": "VERIFERRAILLAGE_15",
   "fr": "\n Commande POST_VERI_FERRAILLAGE :\n  Un seul mot-clé doit être fourni parmi : 'GROUP_MA', 'SEUIL_MIN_MARGE' ou 'NB_DIAG'.\n",
   "placeholders": [],
   "source": {
    "line": 115
   },
   "en": null
  },
  "16": {
   "id": "VERIFERRAILLAGE_16",
   "fr": "\n Commande POST_VERI_FERRAILLAGE :\n  Le calcul des valeurs liées à l'état de la section n'est possible que pour les classes de béton inférieures ou égales à 50 MPa.\n",
   "placeholders": [],
   "source": {
    "line": 121
   },
   "en": null
  },
  "17": {
   "id": "VERIFERRAILLAGE_17",
   "fr": "\n Commande POST_VERI_FERRAILLAGE :\n  La marge est négative pour le torseur d'efforts de calcul. les valeurs de l'état de la section correspondant à l'état limite seront fournies.\n",
   "placeholders": [],
   "source": {
    "line": 127
   },
   "en": null
  },
  "18": {
   "id": "VERIFERRAILLAGE_18",
   "fr": "\n Commande POST_VERI_FERRAILLAGE :\n  Lorsque le torseur des efforts de référence coïncide avec le torseur des efforts de calcul, les efforts normaux et moments résistants de rupture\n  et la distance entre le point correspondant au torseur de référence et celui correspondant au torseur résistant de rupture sont fixés à -1.\n",
   "placeholders": [],
   "source": {
    "line": 133
   },
   "en": null
  },
  "19": {
   "id": "VERIFERRAILLAGE_19",
   "fr": "\n Commande POST_VERI_FERRAILLAGE :\n  On ne retrouve aucune solution d'équilibre pour la section et le torseur d'effort donnés aux ELS.\n",
   "placeholders": [],
   "source": {
    "line": 140
   },
   "en": null
  }
 }
}
