{
 "_generated_from": {
  "upstream": "17.4.26",
  "upstream_commit": "5d2a06d2a4afe589468f96617080e7aabac3e4f2",
  "file": "code_aster/Messages/parallel.py",
  "extractor": "codeaster_en.extract.messages",
  "extractor_version": "1"
 },
 "schema_version": 1,
 "family": "PARALLEL",
 "source": {
  "file": "code_aster/Messages/parallel.py"
 },
 "messages": {
  "1": {
   "id": "PARALLEL_1",
   "fr": "Le processeur #%(i1)d/%(i2)d travaille dans le répertoire '%(k1)s'.\n",
   "placeholders": [
    "%(i1)d",
    "%(i2)d",
    "%(k1)s"
   ],
   "source": {
    "line": 23
   },
   "en": "Processor #%(i1)d/%(i2)d is working in directory '%(k1)s'.\n",
   "method": "assisted",
   "severity_hint": "info",
   "translation_source": "session:task-3.2"
  },
  "2": {
   "id": "PARALLEL_2",
   "fr": "Copie du fichier '%(k1)s' vers '%(k2)s'.\n",
   "placeholders": [
    "%(k1)s",
    "%(k2)s"
   ],
   "source": {
    "line": 27
   },
   "en": "Copying file '%(k1)s' to '%(k2)s'.\n",
   "method": "machine",
   "severity_hint": "info",
   "translation_source": "upstream:i18n/en-US/aster_messages.po"
  }
 }
}
